<!DOCTYPE aspectran PUBLIC "-//ASPECTRAN//DTD Aspectran Configuration 5.0//EN"
                           "http://aspectran.github.io/dtd/aspectran-5.dtd">

<aspectran>

    <description>
        A collection of Translets for the main page.
    </description>

    <translet name="/">
        <dispatch name="templates/default">
            <echo id="page">
                <attributes>
                    <item name="headline">Welcome to Aspectran Demo</item>
                    <item name="teaser">The "Aspectran Demo" is a reference application created to show how to develop Aspectran applications following the recommended best practices.</item>
                    <item name="include">pages/main</item>
                </attributes>
            </echo>
        </dispatch>
    </translet>

</aspectran>