<!DOCTYPE aspectran PUBLIC "-//ASPECTRAN//DTD Aspectran Configuration 5.0//EN"
                           "http://aspectran.github.io/dtd/aspectran-5.dtd">

<aspectran>

    <description>
        Aspectran configuration for embedded mode for tests
    </description>

    <bean id="basePath" class="com.aspectran.core.support.BasePathFactoryBean"/>
    <bean id="currentTranslet" class="com.aspectran.core.support.CurrentTransletFactoryBean" scope="request"/>
    <bean id="currentActivityData" class="com.aspectran.core.support.CurrentActivityDataFactoryBean" scope="request"/>

    <bean scan="com.aspectran.embed.service.**.*Bean" mask="com.aspectran.embed.service.**"/>

    <bean scan="com.aspectran.embed.service.**.*Configuration" mask="com.aspectran.embed.service.**"/>

    <bean scan="com.aspectran.embed.service.**.*Action" mask="com.aspectran.embed.service.**"/>

    <bean id="freemarkerConfigurationFactory" class="com.aspectran.core.support.freemarker.FreeMarkerConfigurationFactoryBean">
        <properties>
            <item name="freemarkerSettings" type="properties">
                <value name="incompatible_improvements">2.3.23</value>
                <value name="template_exception_handler">rethrow</value>
                <value name="default_encoding">UTF-8</value>
                <value name="number_format">0.####</value>
            </item>
            <item name="trimDirectives" valueType="parameters">
                directive: {
                    name: trim
                }
                directive: {
                    name: where
                    prefix: "WHERE "
                    deprefixes: [
                        "and "
                        "and\t"
                        "or "
                        "or\t"
                    ]
                }
                directive: {
                    name: set
                    prefix: "SET "
                    desuffixes: ","
                }
            </item>
        </properties>
    </bean>

    <bean id="freemarker" class="com.aspectran.core.support.freemarker.FreeMarkerTemplateEngine">
        <constructor>
            <arguments>
                <item><call bean="freemarkerConfigurationFactory"/></item>
            </arguments>
        </constructor>
    </bean>

    <aspect id="transletSettings">
        <description>
            Specifies the environment variables used during request and response processing.
        </description>
        <joinpoint target="translet"/>
        <advice>
            <before>
                <echo>
                    <attributes>
                        <item name="data">
                            <call bean="currentActivityData"/>
                        </item>
                    </attributes>
                </echo>
            </before>
        </advice>
    </aspect>

    <translet name="echo123">
        <parameters>
            <item name="input-1">1</item>
            <item name="input-2">2</item>
            <item name="input-3">3</item>
        </parameters>
        <transform type="transform/text" contentType="text/plain">
            <template engine="token" style="apon">
                |------------------------------------------------
                |${input-1}${input-2}${input-3}
                |@{data^input-1}@{data^input-2}@{data^input-3}
                |------------------------------------------------
            </template>
        </transform>
    </translet>

    <translet name="echo">
        <request>
            <parameters>
                <item name="input-1">${input-1:12345}</item>
                <item name="input-2">${input-2:67890}</item>
            </parameters>
        </request>
        <transform type="transform/text" contentType="text/plain">
            <template style="apon">
                |-------------------------------------
                |Using Builtin Token Template Engine
                |-------------------------------------
                |input-1: ${input-1}
                |input-2: ${input-2}
                |-------------------------------------
            </template>
        </transform>
    </translet>

    <template id="echo" engine="token" style="apon">
        |
        |ID: ${id}
        |Name: ${name}
        |Email: ${email}
        |
    </template>

    <template id="selectQuery" engine="freemarker">
        <![CDATA[
        SELECT
            '${name}' as name,
            '${email}' as email
        FROM table1
        <@directive.where>
            <#if id?has_content>
            AND id = :id
            </#if>
            <#if name?has_content>
            AND name = :name
            </#if>
            <#if email?has_content>
            AND email = :email
            </#if>
        </@directive.where>
        ORDER BY name
        ]]>
    </template>

    <template id="updateQuery" engine="freemarker">
        <![CDATA[
        UPDATE table1
        <@directive.set>
            <#if name??>
            name = :name,
            </#if>
            <#if email??>
            email = :email,
            </#if>
            <#if id??>
            id = :id,
            </#if>
        </@directive.set>
        WHERE id = :id
        ]]>
    </template>

    <translet name="include-test">
        <transform type="transform/text" contentType="text/plain">
            <include id="inc" translet="include-target">
                <attributes>
                    <item name="attr-1" value="1"/>
                    <item name="attr-2" value="2"/>
                    <item name="attr-3" value="3"/>
                </attributes>
            </include>
            <action id="action1" bean="SecondBean" method="getMessage"/>
            <template> :: @{action1}</template>
        </transform>
    </translet>

    <translet name="include-target">
        <transform type="transform/text" contentType="text/plain">
            <template>abc@{attr-1}@{attr-2}@{attr-3}</template>
        </transform>
    </translet>

    <translet name="attr-test">
        <request>
            <attributes>
                <item name="attr-1" value="1"/>
                <item name="attr-2" value="2"/>
                <item name="attr-3" value="3"/>
            </attributes>
        </request>
        <transform type="transform/text" contentType="text/plain">
            <template>abc@{attr-1}@{attr-2}@{attr-3}</template>
        </transform>
    </translet>

    <translet name="add-up">
        <action id="result" bean="action.TestAction" method="addUp">
            <arguments>
                <item value="1" valueType="int"/>
                <item value="2" valueType="int"/>
                <item value="3" valueType="int"/>
                <item valueType="int">#{action.TestAction^arg4}</item>
            </arguments>
        </action>
    </translet>

</aspectran>