<!DOCTYPE aspectran PUBLIC "-//ASPECTRAN//DTD Aspectran Configuration 5.0//EN"
                           "http://aspectran.github.io/dtd/aspectran-5.dtd">

<aspectran>

    <translet name="/hello">
        <request>
            <parameters>
                <item name="email" mandatory="true">${id}@${domain}</item>
                <item name="password" mandatory="true" security="true"/>
            </parameters>
            <attributes>
                <item name="attr1" mandatory="true">${id}@${domain}</item>
                <item name="attr2" mandatory="true" security="true">${password}</item>
                <item name="attr3" mandatory="true"/>
                <item name="attr4" mandatory="true"/>
            </attributes>
        </request>
        <transform type="transform/text">
            <template style="apon">
                |------------------------------------------------
                |The parameters you entered are:
                |   email: ${email}
                |   password: ${password}
                |The attributes you entered are:
                |   attr1: @{attr1}
                |   attr2: @{attr2}
                |   attr3: @{attr3}
                |   attr4: @{attr4}
                |------------------------------------------------
            </template>
        </transform>
    </translet>

</aspectran>